{
  "schema_version": "1.0",
  "id": "rx6900xt-qwen36-35b-a3b-iq3xxs-131k-q8-nomtp",
  "title": "Qwen3.6 35B-A3B IQ3_XXS 131K q8 no-MTP on one RX 6900 XT (ROCm/HIP, COMPUTE)",
  "status": "candidate",
  "provenance": "seed-tested",
  "purpose": "Stable 131K q8 route on one RX 6900 XT via ROCm/HIP with full b1024/ub512 and no speculation.",
  "hardware": {
    "lane": "1x-rdna16",
    "gpu_count": 1,
    "gpu_model": "AMD Radeon RX 6900 XT",
    "architecture_family": "RDNA2",
    "architecture_target": "gfx1030",
    "vram_per_gpu_gb": 16,
    "power_profile": "COMPUTE"
  },
  "runtime": {
    "engine": "llama.cpp",
    "backend": "ROCm/HIP",
    "backend_target": "gfx1030",
    "preset_file": "examples/llamacpp-rx6900xt-qwen36-35b-a3b.ini",
    "preset_section": "Qwen3.6-35B-A3B-rdna16-131k-q8kv-nomtp"
  },
  "model": {
    "id": "Qwen3.6-35B-A3B-rdna16-131k-q8kv-nomtp",
    "family": "Qwen3.6",
    "architecture": "moe",
    "parameter_class": "35B-A3B",
    "quant": "UD-IQ3_XXS",
    "source": "unsloth Qwen3.6 MTP GGUF"
  },
  "serving": {
    "kv_cache_k": "q8_0",
    "kv_cache_v": "q8_0",
    "batch_size": 1024,
    "ubatch_size": 512,
    "gpu_layers": 99,
    "parallel": 1,
    "speculation": "none",
    "thinking": "on"
  },
  "profile": "data/benchmark-profiles/high-context.json",
  "context": {
    "target_tokens": 131072,
    "minimum_useful_tokens": 65536
  },
  "known_evidence": [
    "data/results/rx6900xt-qwen36-35b-a3b-131k-q8-nomtp-short.json",
    "data/results/rx6900xt-qwen36-compute-q8-short-20260523.json",
    "data/long-context/rx6900xt-qwen36-35b-a3b-131k-q8-nomtp-needle300k-compute-nothink.json"
  ],
  "caveats": [
    "Evidence is RX 6900 XT-specific (gfx1030, ROCm/HIP); do not generalize to RX 9070 XT or other 16GB Radeon cards.",
    "q8_0 KV is the recommendation floor for this preset; lower KV variants are exploratory only.",
    "Seed rows under known_evidence were captured with request-level disable_thinking; they are provenance for the fit, not evidence for this candidate's thinking route.",
    "This preset is a candidate until the uncached high-context profile (unique leading nonce, cache_prompt=false, sustained generation) passes a review."
  ]
}
