{
  "schema_version": "1.0",
  "id": "rx6900xt-qwen38-27b-iq3xxs-64k-q8-mtp",
  "title": "Qwen3.8 27B IQ3_XXS 64K q8 MTP recommended on one RX 6900 XT (ROCm/HIP, COMPUTE)",
  "status": "recommended",
  "provenance": "seed-tested",
  "purpose": "Recommended dense 27B lane: Qwen3.8-27B UD-IQ3_XXS at 64K with q8_0 K/V, parallel=1, and built-in llama.cpp draft-MTP n=2 / p-min=0.1 at b512/ub128 on one RX 6900 XT, backed by repeated uncached retrieval and sustained-generation evidence.",
  "hardware": {
    "lane": "1x-rdna16",
    "gpu_count": 1,
    "gpu_model": "AMD Radeon RX 6900 XT",
    "architecture_family": "RDNA2",
    "architecture_target": "gfx1030",
    "vram_per_gpu_gb": 16,
    "power_profile": "COMPUTE"
  },
  "runtime": {
    "engine": "llama.cpp",
    "backend": "ROCm/HIP",
    "backend_target": "gfx1030",
    "preset_file": "examples/llamacpp-rx6900xt-qwen38-27b.ini",
    "preset_section": "Qwen3.8-27B-rdna16-64k-q8kv-mtp"
  },
  "model": {
    "id": "qwen38-27b-iq3xxs-rdna16-64k",
    "family": "Qwen3.8",
    "architecture": "dense",
    "parameter_class": "27B",
    "quant": "UD-IQ3_XXS",
    "source": "unsloth Qwen3.8-27B-GGUF"
  },
  "serving": {
    "kv_cache_k": "q8_0",
    "kv_cache_v": "q8_0",
    "batch_size": 512,
    "ubatch_size": 128,
    "gpu_layers": 99,
    "parallel": 1,
    "speculation": "draft-mtp",
    "speculation_n": 2,
    "thinking": "on"
  },
  "profile": "data/benchmark-profiles/high-context.json",
  "context": {
    "target_tokens": 65536,
    "minimum_useful_tokens": 32768
  },
  "known_evidence": [
    "data/evidence/rx6900xt-qwen38-27b-iq3xxs-64k-q8-mtp-65536.json"
  ],
  "caveats": [
    "RX 6900 XT-specific (gfx1030, ROCm/HIP, COMPUTE); do not generalize to RX 9070 XT or other 16GB Radeon cards.",
    "q8_0 KV is the recommendation floor for this preset; lower KV variants are exploratory only.",
    "Exact served shape: b512/ub128, parallel=1, built-in draft-MTP n=2 / p-min=0.1, jinja on, reasoning on (auto), temp 1.0, top-k 20, top-p 0.95, min-p 0, presence-penalty 0, repeat-penalty 1.0.",
    "The published profile validates 64K context fit, retrieval, and sustained generation, not broad model capability or answer quality."
  ]
}
