{
  "schema_version": "1.0",
  "id": "rx6900xt-qwen36-35b-a3b-iq3xxs-100k-q8-mtp-vulkan",
  "title": "Qwen3.6 35B-A3B IQ3_XXS 100K q8 MTP on one RX 6900 XT (Vulkan, 3D_FULL_SCREEN)",
  "status": "candidate",
  "provenance": "seed-tested",
  "purpose": "100K q8 MTP route with built-in draft-mtp n=3 at b512/ub256 on one RX 6900 XT via the Mesa RADV Vulkan build.",
  "hardware": {
    "lane": "1x-rdna16",
    "gpu_count": 1,
    "gpu_model": "AMD Radeon RX 6900 XT",
    "architecture_family": "RDNA2",
    "architecture_target": "gfx1030",
    "vram_per_gpu_gb": 16,
    "power_profile": "3D_FULL_SCREEN"
  },
  "runtime": {
    "engine": "llama.cpp",
    "backend": "Vulkan",
    "backend_target": "gfx1030",
    "preset_file": "examples/llamacpp-rx6900xt-qwen36-35b-a3b.ini",
    "preset_section": "Qwen3.6-35B-A3B-rdna16-100k-q8kv-mtp"
  },
  "model": {
    "id": "Qwen3.6-35B-A3B-rdna16-100k-q8kv-mtp-vulkan",
    "family": "Qwen3.6",
    "architecture": "moe",
    "parameter_class": "35B-A3B",
    "quant": "UD-IQ3_XXS",
    "source": "unsloth Qwen3.6 MTP GGUF"
  },
  "serving": {
    "kv_cache_k": "q8_0",
    "kv_cache_v": "q8_0",
    "batch_size": 512,
    "ubatch_size": 256,
    "gpu_layers": 99,
    "parallel": 1,
    "speculation": "draft-mtp",
    "speculation_n": 3,
    "thinking": "on"
  },
  "profile": "data/benchmark-profiles/high-context.json",
  "context": {
    "target_tokens": 102400,
    "minimum_useful_tokens": 65536
  },
  "known_evidence": [
    "data/results/rx6900xt-qwen36-vulkan-mtp-q8-20260523.json"
  ],
  "caveats": [
    "Evidence is RX 6900 XT-specific (gfx1030, Vulkan RADV Mesa 26.2.0-devel); do not generalize to RX 9070 XT or other 16GB Radeon cards.",
    "This Vulkan route was measured under the 3D_FULL_SCREEN power profile; the COMPUTE profile rows are a separate preset lane (ROCm/HIP).",
    "q8_0 KV is the recommendation floor for this preset; lower KV variants are exploratory only.",
    "The seed Vulkan row under known_evidence was captured with request-level disable_thinking; it is provenance for the fit, not evidence for this candidate's thinking route.",
    "This preset is a candidate until the uncached high-context profile (unique leading nonce, cache_prompt=false, sustained generation) passes a review."
  ]
}
